"No.","Time","Source","Destination","Protocol","Length","Info"
"1","0.000000","10.0.0.7","104.16.109.18","TCP","54","61640  >  443 [ACK] Seq=1 Ack=1 Win=32768 Len=0"
"2","0.501973","Technico_57:12:15","Broadcast","ARP","60","Who has 10.0.0.19? Tell 10.0.0.1"
"3","0.503184","Technico_57:12:15","Broadcast","ARP","60","Who has 10.0.0.11? Tell 10.0.0.1"
"4","0.504285","Technico_57:12:15","Broadcast","ARP","60","Who has 10.0.0.8? Tell 10.0.0.1"
"5","0.505402","Technico_57:12:15","Broadcast","ARP","60","Who has 10.0.0.20? Tell 10.0.0.1"
"6","0.784860","2601:14c:4302:90c0:5915:693a:b5c4:d777","2607:f8b0:400d:c0d::6d","TLSv1.2","121","Application Data"
"7","0.788553","2601:14c:4302:90c0:5915:693a:b5c4:d777","2001:558:feed::1","DNS","94","Standard query 0x6ef8 AAAA imap.gmail.com"
"8","0.788656","2601:14c:4302:90c0:5915:693a:b5c4:d777","2001:558:feed::1","DNS","94","Standard query 0xdfd8 A imap.gmail.com"
"9","0.801565","2001:558:feed::1","2601:14c:4302:90c0:5915:693a:b5c4:d777","DNS","156","Standard query response 0x6ef8 AAAA imap.gmail.com CNAME gmail-imap.l.google.com AAAA 2607:f8b0:400d:c0b::6c"
"10","0.801816","2601:14c:4302:90c0:5915:693a:b5c4:d777","2001:558:feed::1","DNS","103","Standard query 0xdfd8 A gmail-imap.l.google.com"
"11","0.802770","2601:14c:4302:90c0:5915:693a:b5c4:d777","2607:f8b0:400d:c0b::6c","TCP","98","61711  >  993 [SYN] Seq=0 Win=65535 Len=0 MSS=1440 WS=32 TSval=113523193 TSecr=0 SACK_PERM=1"
"12","0.808127","2001:558:feed::1","2601:14c:4302:90c0:5915:693a:b5c4:d777","DNS","160","Standard query response 0xdfd8 A imap.gmail.com CNAME gmail-imap.l.google.com A 209.85.201.108 A 209.85.201.109"
"13","0.817342","2001:558:feed::1","2601:14c:4302:90c0:5915:693a:b5c4:d777","DNS","135","Standard query response 0xdfd8 A gmail-imap.l.google.com A 209.85.201.108 A 209.85.201.109"
"14","0.817416","2601:14c:4302:90c0:5915:693a:b5c4:d777","2001:558:feed::1","ICMPv6","183","Destination Unreachable (Port unreachable)"
"15","0.823029","2607:f8b0:400d:c0d::6d","2601:14c:4302:90c0:5915:693a:b5c4:d777","TLSv1.2","151","Application Data"
"16","0.823104","2601:14c:4302:90c0:5915:693a:b5c4:d777","2607:f8b0:400d:c0d::6d","TCP","86","61316  >  993 [ACK] Seq=36 Ack=66 Win=7716 Len=0 TSval=113523213 TSecr=2495820246"
"17","0.823690","2601:14c:4302:90c0:5915:693a:b5c4:d777","2607:f8b0:400d:c0d::6d","TLSv1.2","128","Application Data"
"18","0.830036","2607:f8b0:400d:c0b::6c","2601:14c:4302:90c0:5915:693a:b5c4:d777","TCP","94","993  >  61711 [SYN, ACK] Seq=0 Ack=1 Win=43136 Len=0 MSS=1360 SACK_PERM=1 TSval=3351288375 TSecr=113523193 WS=128"
"19","0.830186","2601:14c:4302:90c0:5915:693a:b5c4:d777","2607:f8b0:400d:c0b::6c","TCP","86","61711  >  993 [ACK] Seq=1 Ack=1 Win=132096 Len=0 TSval=113523220 TSecr=3351288375"
"20","0.830934","2601:14c:4302:90c0:5915:693a:b5c4:d777","2607:f8b0:400d:c0b::6c","TLSv1.2","282","Client Hello"
"21","0.851251","2607:f8b0:400d:c0b::6c","2601:14c:4302:90c0:5915:693a:b5c4:d777","TCP","86","993  >  61711 [ACK] Seq=1 Ack=197 Win=44288 Len=0 TSval=3351288397 TSecr=113523220"
"22","0.852996","2607:f8b0:400d:c0b::6c","2601:14c:4302:90c0:5915:693a:b5c4:d777","TLSv1.2","1294","Server Hello"
"23","0.853378","2607:f8b0:400d:c0b::6c","2601:14c:4302:90c0:5915:693a:b5c4:d777","TCP","1294","[TCP segment of a reassembled PDU]"
"24","0.853478","2601:14c:4302:90c0:5915:693a:b5c4:d777","2607:f8b0:400d:c0b::6c","TCP","86","61711  >  993 [ACK] Seq=197 Ack=2417 Win=129856 Len=0 TSval=113523241 TSecr=3351288398"
"25","0.853823","2607:f8b0:400d:c0b::6c","2601:14c:4302:90c0:5915:693a:b5c4:d777","TLSv1.2","1294","Certificate[TCP segment of a reassembled PDU]"
"26","0.853826","2607:f8b0:400d:c0b::6c","2601:14c:4302:90c0:5915:693a:b5c4:d777","TLSv1.2","294","Server Key Exchange, Server Hello Done"
"27","0.853878","2601:14c:4302:90c0:5915:693a:b5c4:d777","2607:f8b0:400d:c0b::6c","TCP","86","61711  >  993 [ACK] Seq=197 Ack=3833 Win=129632 Len=0 TSval=113523241 TSecr=3351288398"
"28","0.881436","2601:14c:4302:90c0:5915:693a:b5c4:d777","2607:f8b0:400d:c0b::6c","TLSv1.2","161","Client Key Exchange"
"29","0.884131","2607:f8b0:400d:c0d::6d","2601:14c:4302:90c0:5915:693a:b5c4:d777","TCP","86","993  >  61316 [ACK] Seq=66 Ack=78 Win=365 Len=0 TSval=2495820308 TSecr=113523213"
"30","0.910555","2607:f8b0:400d:c0d::6d","2601:14c:4302:90c0:5915:693a:b5c4:d777","TLSv1.2","133","Application Data"
"31","0.910631","2601:14c:4302:90c0:5915:693a:b5c4:d777","2607:f8b0:400d:c0d::6d","TCP","86","61316  >  993 [ACK] Seq=78 Ack=113 Win=7717 Len=0 TSval=113523296 TSecr=2495820331"
"32","0.911254","2601:14c:4302:90c0:5915:693a:b5c4:d777","2607:f8b0:400d:c0d::6d","TLSv1.2","191","Application Data"
"33","0.931537","2607:f8b0:400d:c0d::6d","2601:14c:4302:90c0:5915:693a:b5c4:d777","TCP","86","993  >  61316 [ACK] Seq=113 Ack=183 Win=365 Len=0 TSval=2495820355 TSecr=113523296"
"34","0.941472","2607:f8b0:400d:c0b::6c","2601:14c:4302:90c0:5915:693a:b5c4:d777","TCP","86","993  >  61711 [ACK] Seq=3833 Ack=272 Win=44288 Len=0 TSval=3351288487 TSecr=113523269"
"35","0.941569","2601:14c:4302:90c0:5915:693a:b5c4:d777","2607:f8b0:400d:c0b::6c","TLSv1.2","137","Change Cipher Spec, Encrypted Handshake Message"
"36","0.945294","2607:f8b0:400d:c0d::6d","2601:14c:4302:90c0:5915:693a:b5c4:d777","TLSv1.2","149","Application Data"
"37","0.945360","2601:14c:4302:90c0:5915:693a:b5c4:d777","2607:f8b0:400d:c0d::6d","TCP","86","61316  >  993 [ACK] Seq=183 Ack=176 Win=7716 Len=0 TSval=113523328 TSecr=2495820369"
"38","0.945687","2607:f8b0:400d:c0d::6d","2601:14c:4302:90c0:5915:693a:b5c4:d777","TLSv1.2","197","Application Data"
"39","0.945746","2601:14c:4302:90c0:5915:693a:b5c4:d777","2607:f8b0:400d:c0d::6d","TCP","86","61316  >  993 [ACK] Seq=183 Ack=287 Win=7715 Len=0 TSval=113523328 TSecr=2495820369"
"40","0.958088","2601:14c:4302:90c0:5915:693a:b5c4:d777","2607:f8b0:400d:c0d::6d","TLSv1.2","132","Application Data"
"41","0.962324","2607:f8b0:400d:c0b::6c","2601:14c:4302:90c0:5915:693a:b5c4:d777","TCP","86","993  >  61711 [ACK] Seq=3833 Ack=323 Win=44288 Len=0 TSval=3351288507 TSecr=113523325"
"42","0.962705","2607:f8b0:400d:c0b::6c","2601:14c:4302:90c0:5915:693a:b5c4:d777","TLSv1.2","137","Change Cipher Spec, Hello Request, Hello Request"
"43","0.962809","2601:14c:4302:90c0:5915:693a:b5c4:d777","2607:f8b0:400d:c0b::6c","TCP","86","61711  >  993 [ACK] Seq=323 Ack=3884 Win=131008 Len=0 TSval=113523344 TSecr=3351288507"
"44","0.963068","2607:f8b0:400d:c0b::6c","2601:14c:4302:90c0:5915:693a:b5c4:d777","TLSv1.2","208","Application Data"
"45","0.963136","2601:14c:4302:90c0:5915:693a:b5c4:d777","2607:f8b0:400d:c0b::6c","TCP","86","61711  >  993 [ACK] Seq=323 Ack=4006 Win=130944 Len=0 TSval=113523344 TSecr=3351288508"
"46","0.963735","2601:14c:4302:90c0:5915:693a:b5c4:d777","2607:f8b0:400d:c0b::6c","TLSv1.2","131","Application Data"
"47","0.984424","2607:f8b0:400d:c0b::6c","2601:14c:4302:90c0:5915:693a:b5c4:d777","TLSv1.2","335","Application Data"
"48","0.984562","2601:14c:4302:90c0:5915:693a:b5c4:d777","2607:f8b0:400d:c0b::6c","TCP","86","61711  >  993 [ACK] Seq=368 Ack=4255 Win=130816 Len=0 TSval=113523365 TSecr=3351288530"
"49","0.985522","2601:14c:4302:90c0:5915:693a:b5c4:d777","2607:f8b0:400d:c0b::6c","TLSv1.2","241","Application Data"
"50","0.998275","2607:f8b0:400d:c0d::6d","2601:14c:4302:90c0:5915:693a:b5c4:d777","TLSv1.2","245","Application Data"
"51","0.998355","2601:14c:4302:90c0:5915:693a:b5c4:d777","2607:f8b0:400d:c0d::6d","TCP","86","61316  >  993 [ACK] Seq=229 Ack=446 Win=7713 Len=0 TSval=113523378 TSecr=2495820421"
"52","0.999084","2607:f8b0:400d:c0d::6d","2601:14c:4302:90c0:5915:693a:b5c4:d777","TLSv1.2","373","Application Data"
"53","0.999088","2607:f8b0:400d:c0d::6d","2601:14c:4302:90c0:5915:693a:b5c4:d777","TLSv1.2","654","Application Data"
"54","0.999150","2601:14c:4302:90c0:5915:693a:b5c4:d777","2607:f8b0:400d:c0d::6d","TCP","86","61316  >  993 [ACK] Seq=229 Ack=733 Win=7709 Len=0 TSval=113523378 TSecr=2495820422"
"55","0.999174","2601:14c:4302:90c0:5915:693a:b5c4:d777","2607:f8b0:400d:c0d::6d","TCP","86","61316  >  993 [ACK] Seq=229 Ack=1301 Win=7692 Len=0 TSval=113523378 TSecr=2495820422"
"56","1.001682","2601:14c:4302:90c0:5915:693a:b5c4:d777","2607:f8b0:400d:c0d::6d","TLSv1.2","192","Application Data"
"57","1.004489","2601:14c:4302:90c0:5915:693a:b5c4:d777","2607:f8b0:400d:c0d::6d","TLSv1.2","1434","Application Data, Application Data, Application Data, Application Data, Application Data, Application Data, Application Data, Application Data, Application Data, Application Data, Application Data, Application Data, Application Data"
"58","1.004490","2601:14c:4302:90c0:5915:693a:b5c4:d777","2607:f8b0:400d:c0d::6d","TLSv1.2","127","Application Data"
"59","1.006469","2607:f8b0:400d:c0b::6c","2601:14c:4302:90c0:5915:693a:b5c4:d777","TLSv1.2","337","Application Data"
"60","1.006548","2601:14c:4302:90c0:5915:693a:b5c4:d777","2607:f8b0:400d:c0b::6c","TCP","86","61711  >  993 [ACK] Seq=523 Ack=4506 Win=130816 Len=0 TSval=113523385 TSecr=3351288551"
"61","1.007744","2601:14c:4302:90c0:5915:693a:b5c4:d777","2607:f8b0:400d:c0b::6c","TLSv1.2","414","Application Data"
"62","1.022118","2607:f8b0:400d:c0d::6d","2601:14c:4302:90c0:5915:693a:b5c4:d777","TCP","86","993  >  61316 [ACK] Seq=1301 Ack=335 Win=365 Len=0 TSval=2495820446 TSecr=113523381"
"63","1.028065","2607:f8b0:400d:c0d::6d","2601:14c:4302:90c0:5915:693a:b5c4:d777","TCP","86","993  >  61316 [ACK] Seq=1301 Ack=1724 Win=375 Len=0 TSval=2495820451 TSecr=113523383"
"64","1.028129","2601:14c:4302:90c0:5915:693a:b5c4:d777","2607:f8b0:400d:c0d::6d","TLSv1.2","361","Application Data, Application Data, Application Data"
"65","1.034469","2607:f8b0:400d:c0d::6d","2601:14c:4302:90c0:5915:693a:b5c4:d777","TLSv1.2","231","Application Data"
"66","1.034521","2601:14c:4302:90c0:5915:693a:b5c4:d777","2607:f8b0:400d:c0d::6d","TCP","86","61316  >  993 [ACK] Seq=1999 Ack=1446 Win=7714 Len=0 TSval=113523411 TSecr=2495820458"
"67","1.042752","2607:f8b0:400d:c0d::6d","2601:14c:4302:90c0:5915:693a:b5c4:d777","TLSv1.2","228","Application Data"
"68","1.042822","2601:14c:4302:90c0:5915:693a:b5c4:d777","2607:f8b0:400d:c0d::6d","TCP","86","61316  >  993 [ACK] Seq=1999 Ack=1588 Win=7714 Len=0 TSval=113523419 TSecr=2495820466"
"69","1.043537","2607:f8b0:400d:c0d::6d","2601:14c:4302:90c0:5915:693a:b5c4:d777","TLSv1.2","228","Application Data"
"70","1.043600","2601:14c:4302:90c0:5915:693a:b5c4:d777","2607:f8b0:400d:c0d::6d","TCP","86","61316  >  993 [ACK] Seq=1999 Ack=1730 Win=7714 Len=0 TSval=113523419 TSecr=2495820467"
"71","1.044281","2607:f8b0:400d:c0d::6d","2601:14c:4302:90c0:5915:693a:b5c4:d777","TLSv1.2","230","Application Data"
"72","1.044326","2601:14c:4302:90c0:5915:693a:b5c4:d777","2607:f8b0:400d:c0d::6d","TCP","86","61316  >  993 [ACK] Seq=1999 Ack=1874 Win=7714 Len=0 TSval=113523420 TSecr=2495820467"
"73","1.044690","2607:f8b0:400d:c0d::6d","2601:14c:4302:90c0:5915:693a:b5c4:d777","TLSv1.2","228","Application Data"
"74","1.044731","2601:14c:4302:90c0:5915:693a:b5c4:d777","2607:f8b0:400d:c0d::6d","TCP","86","61316  >  993 [ACK] Seq=1999 Ack=2016 Win=7714 Len=0 TSval=113523420 TSecr=2495820468"
"75","1.045414","2607:f8b0:400d:c0d::6d","2601:14c:4302:90c0:5915:693a:b5c4:d777","TLSv1.2","227","Application Data"
"76","1.045457","2601:14c:4302:90c0:5915:693a:b5c4:d777","2607:f8b0:400d:c0d::6d","TCP","86","61316  >  993 [ACK] Seq=1999 Ack=2157 Win=7714 Len=0 TSval=113523421 TSecr=2495820469"
"77","1.046010","2607:f8b0:400d:c0d::6d","2601:14c:4302:90c0:5915:693a:b5c4:d777","TLSv1.2","219","Application Data"
"78","1.046055","2601:14c:4302:90c0:5915:693a:b5c4:d777","2607:f8b0:400d:c0d::6d","TCP","86","61316  >  993 [ACK] Seq=1999 Ack=2290 Win=7714 Len=0 TSval=113523421 TSecr=2495820469"
"79","1.075267","2607:f8b0:400d:c0b::6c","2601:14c:4302:90c0:5915:693a:b5c4:d777","TCP","86","993  >  61711 [ACK] Seq=4506 Ack=851 Win=46464 Len=0 TSval=3351288620 TSecr=113523386"
"80","1.088476","2607:f8b0:400d:c0d::6d","2601:14c:4302:90c0:5915:693a:b5c4:d777","TCP","86","993  >  61316 [ACK] Seq=2290 Ack=1999 Win=386 Len=0 TSval=2495820512 TSecr=113523405"
"81","1.169157","2607:f8b0:400d:c0d::6d","2601:14c:4302:90c0:5915:693a:b5c4:d777","TLSv1.2","229","Application Data"
"82","1.169246","2601:14c:4302:90c0:5915:693a:b5c4:d777","2607:f8b0:400d:c0d::6d","TCP","86","61316  >  993 [ACK] Seq=1999 Ack=2433 Win=7714 Len=0 TSval=113523543 TSecr=2495820593"
"83","1.170012","2607:f8b0:400d:c0b::6c","2601:14c:4302:90c0:5915:693a:b5c4:d777","TLSv1.2","390","Application Data"
"84","1.170086","2601:14c:4302:90c0:5915:693a:b5c4:d777","2607:f8b0:400d:c0b::6c","TCP","86","61711  >  993 [ACK] Seq=851 Ack=4810 Win=130752 Len=0 TSval=113523543 TSecr=3351288715"
"85","1.170744","2601:14c:4302:90c0:5915:693a:b5c4:d777","2607:f8b0:400d:c0b::6c","TLSv1.2","131","Application Data"
"86","1.191495","2607:f8b0:400d:c0b::6c","2601:14c:4302:90c0:5915:693a:b5c4:d777","TCP","86","993  >  61711 [ACK] Seq=4810 Ack=896 Win=46464 Len=0 TSval=3351288736 TSecr=113523544"
"87","1.191889","2607:f8b0:400d:c0b::6c","2601:14c:4302:90c0:5915:693a:b5c4:d777","TCP","86","[TCP Dup ACK 86#1] 993  >  61711 [ACK] Seq=4810 Ack=896 Win=46464 Len=0 TSval=3351288736 TSecr=113523544"
"88","1.260460","2607:f8b0:400d:c0d::6d","2601:14c:4302:90c0:5915:693a:b5c4:d777","TLSv1.2","219","Application Data"
"89","1.260561","2601:14c:4302:90c0:5915:693a:b5c4:d777","2607:f8b0:400d:c0d::6d","TCP","86","61316  >  993 [ACK] Seq=1999 Ack=2566 Win=7714 Len=0 TSval=113523633 TSecr=2495820684"
"90","1.261311","2607:f8b0:400d:c0d::6d","2601:14c:4302:90c0:5915:693a:b5c4:d777","TLSv1.2","226","Application Data"
"91","1.261387","2601:14c:4302:90c0:5915:693a:b5c4:d777","2607:f8b0:400d:c0d::6d","TCP","86","61316  >  993 [ACK] Seq=1999 Ack=2706 Win=7714 Len=0 TSval=113523633 TSecr=2495820684"
"92","1.261796","2607:f8b0:400d:c0d::6d","2601:14c:4302:90c0:5915:693a:b5c4:d777","TLSv1.2","219","Application Data"
"93","1.261861","2601:14c:4302:90c0:5915:693a:b5c4:d777","2607:f8b0:400d:c0d::6d","TCP","86","61316  >  993 [ACK] Seq=1999 Ack=2839 Win=7714 Len=0 TSval=113523634 TSecr=2495820685"
"94","1.262543","2607:f8b0:400d:c0d::6d","2601:14c:4302:90c0:5915:693a:b5c4:d777","TLSv1.2","217","Application Data"
"95","1.262589","2601:14c:4302:90c0:5915:693a:b5c4:d777","2607:f8b0:400d:c0d::6d","TCP","86","61316  >  993 [ACK] Seq=1999 Ack=2970 Win=7714 Len=0 TSval=113523634 TSecr=2495820686"
"96","1.263158","2607:f8b0:400d:c0d::6d","2601:14c:4302:90c0:5915:693a:b5c4:d777","TLSv1.2","219","Application Data"
"97","1.263204","2601:14c:4302:90c0:5915:693a:b5c4:d777","2607:f8b0:400d:c0d::6d","TCP","86","61316  >  993 [ACK] Seq=1999 Ack=3103 Win=7714 Len=0 TSval=113523635 TSecr=2495820686"
"98","1.263771","2607:f8b0:400d:c0d::6d","2601:14c:4302:90c0:5915:693a:b5c4:d777","TLSv1.2","225","Application Data"
"99","1.263813","2601:14c:4302:90c0:5915:693a:b5c4:d777","2607:f8b0:400d:c0d::6d","TCP","86","61316  >  993 [ACK] Seq=1999 Ack=3242 Win=7714 Len=0 TSval=113523635 TSecr=2495820687"
"100","1.264401","2607:f8b0:400d:c0d::6d","2601:14c:4302:90c0:5915:693a:b5c4:d777","TLSv1.2","217","Application Data"
"101","1.264439","2601:14c:4302:90c0:5915:693a:b5c4:d777","2607:f8b0:400d:c0d::6d","TCP","86","61316  >  993 [ACK] Seq=1999 Ack=3373 Win=7714 Len=0 TSval=113523636 TSecr=2495820688"
"102","1.265023","2607:f8b0:400d:c0d::6d","2601:14c:4302:90c0:5915:693a:b5c4:d777","TLSv1.2","215","Application Data"
"103","1.265059","2601:14c:4302:90c0:5915:693a:b5c4:d777","2607:f8b0:400d:c0d::6d","TCP","86","61316  >  993 [ACK] Seq=1999 Ack=3502 Win=7714 Len=0 TSval=113523636 TSecr=2495820688"
"104","1.265770","2607:f8b0:400d:c0d::6d","2601:14c:4302:90c0:5915:693a:b5c4:d777","TLSv1.2","218","Application Data"
"105","1.265806","2601:14c:4302:90c0:5915:693a:b5c4:d777","2607:f8b0:400d:c0d::6d","TCP","86","61316  >  993 [ACK] Seq=1999 Ack=3634 Win=7714 Len=0 TSval=113523637 TSecr=2495820689"
"106","1.266545","2607:f8b0:400d:c0d::6d","2601:14c:4302:90c0:5915:693a:b5c4:d777","TLSv1.2","220","Application Data"
"107","1.266586","2601:14c:4302:90c0:5915:693a:b5c4:d777","2607:f8b0:400d:c0d::6d","TCP","86","61316  >  993 [ACK] Seq=1999 Ack=3768 Win=7714 Len=0 TSval=113523637 TSecr=2495820690"
"108","1.272005","2607:f8b0:400d:c0b::6c","2601:14c:4302:90c0:5915:693a:b5c4:d777","TLSv1.2","349","Application Data"
"109","1.272106","2601:14c:4302:90c0:5915:693a:b5c4:d777","2607:f8b0:400d:c0b::6c","TCP","86","61711  >  993 [ACK] Seq=896 Ack=5073 Win=130784 Len=0 TSval=113523643 TSecr=3351288817"
"110","1.279547","2601:14c:4302:90c0:5915:693a:b5c4:d777","2607:f8b0:400d:c0d::6d","TLSv1.2","132","Application Data"
"111","1.299836","2607:f8b0:400d:c0d::6d","2601:14c:4302:90c0:5915:693a:b5c4:d777","TCP","86","993  >  61316 [ACK] Seq=3768 Ack=2045 Win=386 Len=0 TSval=2495820723 TSecr=113523650"
"112","1.313650","2607:f8b0:400d:c0d::6d","2601:14c:4302:90c0:5915:693a:b5c4:d777","TLSv1.2","245","Application Data"
"113","1.313733","2601:14c:4302:90c0:5915:693a:b5c4:d777","2607:f8b0:400d:c0d::6d","TCP","86","61316  >  993 [ACK] Seq=2045 Ack=3927 Win=7713 Len=0 TSval=113523683 TSecr=2495820737"
"114","1.320533","2607:f8b0:400d:c0d::6d","2601:14c:4302:90c0:5915:693a:b5c4:d777","TLSv1.2","887","Application Data"
"115","1.320607","2601:14c:4302:90c0:5915:693a:b5c4:d777","2607:f8b0:400d:c0d::6d","TCP","86","61316  >  993 [ACK] Seq=2045 Ack=4728 Win=7693 Len=0 TSval=113523689 TSecr=2495820737"
"116","1.320852","2607:f8b0:400d:c0d::6d","2601:14c:4302:90c0:5915:693a:b5c4:d777","TLSv1.2","140","Application Data"
"117","1.320910","2601:14c:4302:90c0:5915:693a:b5c4:d777","2607:f8b0:400d:c0d::6d","TCP","86","61316  >  993 [ACK] Seq=2045 Ack=4782 Win=7717 Len=0 TSval=113523689 TSecr=2495820737"
"118","1.323148","2601:14c:4302:90c0:5915:693a:b5c4:d777","2607:f8b0:400d:c0d::6d","TLSv1.2","127","Application Data"
"119","1.357175","2607:f8b0:400d:c0d::6d","2601:14c:4302:90c0:5915:693a:b5c4:d777","TLSv1.2","125","Application Data"
"120","1.357250","2601:14c:4302:90c0:5915:693a:b5c4:d777","2607:f8b0:400d:c0d::6d","TCP","86","61316  >  993 [ACK] Seq=2086 Ack=4821 Win=7717 Len=0 TSval=113523725 TSecr=2495820780"
"121","1.358395","2601:14c:4302:90c0:5915:693a:b5c4:d777","2607:f8b0:400d:c0b::6c","TLSv1.2","127","Application Data"
"122","1.358782","2601:14c:4302:90c0:5915:693a:b5c4:d777","2607:f8b0:400d:c0b::6c","TCP","86","61711  >  993 [FIN, ACK] Seq=937 Ack=5073 Win=131072 Len=0 TSval=113523726 TSecr=3351288817"
"123","1.379118","2607:f8b0:400d:c0b::6c","2601:14c:4302:90c0:5915:693a:b5c4:d777","TCP","98","[TCP Dup ACK 86#2] 993  >  61711 [ACK] Seq=5073 Ack=896 Win=46464 Len=0 TSval=3351288924 TSecr=113523643 SLE=937 SRE=938"
"124","1.379229","2601:14c:4302:90c0:5915:693a:b5c4:d777","2607:f8b0:400d:c0b::6c","TLSv1.2","127","[TCP Fast Retransmission] , Application Data"
"125","1.379434","2607:f8b0:400d:c0b::6c","2601:14c:4302:90c0:5915:693a:b5c4:d777","TCP","86","993  >  61711 [ACK] Seq=5073 Ack=938 Win=46464 Len=0 TSval=3351288924 TSecr=113523726"
"126","1.399390","2607:f8b0:400d:c0b::6c","2601:14c:4302:90c0:5915:693a:b5c4:d777","TCP","98","[TCP Dup ACK 125#1] 993  >  61711 [ACK] Seq=5073 Ack=938 Win=46464 Len=0 TSval=3351288945 TSecr=113523746 SLE=896 SRE=938"
"127","1.586651","2607:f8b0:400d:c0b::6c","2601:14c:4302:90c0:5915:693a:b5c4:d777","TCP","86","993  >  61711 [FIN, ACK] Seq=5073 Ack=938 Win=46464 Len=0 TSval=3351289132 TSecr=113523746"
"128","1.586732","2601:14c:4302:90c0:5915:693a:b5c4:d777","2607:f8b0:400d:c0b::6c","TCP","86","61711  >  993 [ACK] Seq=938 Ack=5074 Win=131072 Len=0 TSval=113523952 TSecr=3351289132"
"129","2.488568","10.0.0.7","23.64.65.225","TLSv1.2","426","Application Data"
"130","2.506376","23.64.65.225","10.0.0.7","TLSv1.2","376","Application Data"
"131","2.506466","10.0.0.7","23.64.65.225","TCP","66","61709  >  443 [ACK] Seq=361 Ack=311 Win=4086 Len=0 TSval=113524865 TSecr=836971570"
"132","4.579575","10.0.0.7","23.64.65.225","TLSv1.2","432","Application Data"
"133","4.598167","23.64.65.225","10.0.0.7","TLSv1.2","377","Application Data"
"134","4.598247","10.0.0.7","23.64.65.225","TCP","66","61709  >  443 [ACK] Seq=727 Ack=622 Win=4086 Len=0 TSval=113526953 TSecr=836973661"
"135","5.080319","2601:14c:4302:90c0:5915:693a:b5c4:d777","2001:558:feed::1","DNS","99","Standard query 0x2267 A ajax.googleapis.com"
"136","5.080535","2601:14c:4302:90c0:5915:693a:b5c4:d777","2001:558:feed::1","DNS","99","Standard query 0xb851 AAAA ajax.googleapis.com"
"137","5.080715","2601:14c:4302:90c0:5915:693a:b5c4:d777","2604:a880:400:d0::2221:3001","TCP","86","61702  >  443 [FIN, ACK] Seq=1 Ack=1 Win=32768 Len=0 TSval=113527432 TSecr=38782571"
"138","5.080851","10.0.0.7","52.41.196.250","TCP","66","61635  >  443 [FIN, ACK] Seq=1 Ack=1 Win=4096 Len=0 TSval=113527432 TSecr=6792228"
"139","5.081061","10.0.0.7","54.235.65.212","TCP","66","61701  >  443 [FIN, ACK] Seq=1 Ack=1 Win=4096 Len=0 TSval=113527432 TSecr=918070515"
"140","5.081189","10.0.0.7","104.16.109.18","TCP","54","[TCP Previous segment not captured] 61640  >  443 [FIN, ACK] Seq=2 Ack=1 Win=32768 Len=0"
"141","5.081295","10.0.0.7","104.16.3.9","TCP","54","61648  >  443 [FIN, ACK] Seq=1 Ack=1 Win=8192 Len=0"
"142","5.081478","10.0.0.7","104.16.3.9","TCP","54","61649  >  443 [FIN, ACK] Seq=1 Ack=1 Win=8192 Len=0"
"143","5.081604","10.0.0.7","23.34.1.71","TCP","66","61645  >  443 [FIN, ACK] Seq=1 Ack=1 Win=4096 Len=0 TSval=113527432 TSecr=836787780"
"144","5.081839","10.0.0.7","104.17.31.15","TCP","54","61643  >  443 [FIN, ACK] Seq=1 Ack=1 Win=8192 Len=0"
"145","5.082039","10.0.0.7","35.162.141.229","TCP","66","61694  >  80 [FIN, ACK] Seq=1 Ack=1 Win=4096 Len=0 TSval=113527433 TSecr=6773471"
"146","5.082098","10.0.0.7","198.232.125.123","TCP","54","61699  >  443 [FIN, ACK] Seq=1 Ack=1 Win=8192 Len=0"
"147","5.082145","10.0.0.7","198.232.125.123","TCP","54","61697  >  443 [FIN, ACK] Seq=1 Ack=1 Win=8192 Len=0"
"148","5.082331","2601:14c:4302:90c0:5915:693a:b5c4:d777","2001:558:feed::1","DNS","101","Standard query 0xe706 A eue.collect-opnet.com"
"149","5.082441","2601:14c:4302:90c0:5915:693a:b5c4:d777","2001:558:feed::1","DNS","101","Standard query 0x1b6b AAAA eue.collect-opnet.com"
"150","5.082713","2601:14c:4302:90c0:5915:693a:b5c4:d777","2001:558:feed::1","DNS","100","Standard query 0xc05f A fonts.googleapis.com"
"151","5.082811","2601:14c:4302:90c0:5915:693a:b5c4:d777","2001:558:feed::1","DNS","100","Standard query 0xd21b AAAA fonts.googleapis.com"
"152","5.094196","2601:14c:4302:90c0:5915:693a:b5c4:d777","2400:cb00:2048:1::6819:da15","TLSv1.2","185","Application Data"
"153","5.094197","2601:14c:4302:90c0:5915:693a:b5c4:d777","2400:cb00:2048:1::6819:da15","TLSv1.2","120","Application Data"
"154","5.096895","2001:558:feed::1","2601:14c:4302:90c0:5915:693a:b5c4:d777","DNS","229","Standard query response 0x2267 A ajax.googleapis.com CNAME googleapis.l.google.com A 172.217.7.234 A 172.217.5.234 A 172.217.7.138 A 172.217.7.170 A 172.217.7.202 A 216.58.217.170"
"155","5.097150","2601:14c:4302:90c0:5915:693a:b5c4:d777","2001:558:feed::1","DNS","104","Standard query 0x23e2 A ssl.google-analytics.com"
"156","5.098585","2001:558:feed::1","2601:14c:4302:90c0:5915:693a:b5c4:d777","DNS","161","Standard query response 0xb851 AAAA ajax.googleapis.com CNAME googleapis.l.google.com AAAA 2607:f8b0:4004:80f::200a"
"157","5.099224","2601:14c:4302:90c0:5915:693a:b5c4:d777","2001:558:feed::1","DNS","104","Standard query 0xbc9d AAAA ssl.google-analytics.com"
"158","5.102284","2601:14c:4302:90c0:5915:693a:b5c4:d777","2607:f8b0:4004:80f::200a","QUIC","1412","Client Hello, PKN: 1, CID: 14202550144851529852"
"159","5.102411","2001:558:feed::1","2601:14c:4302:90c0:5915:693a:b5c4:d777","DNS","164","Standard query response 0xd21b AAAA fonts.googleapis.com CNAME googleadapis.l.google.com AAAA 2607:f8b0:4004:802::200a"
"160","5.102652","2601:14c:4302:90c0:5915:693a:b5c4:d777","2001:558:feed::1","DNS","103","Standard query 0x9f72 A maxcdn.bootstrapcdn.com"
"161","5.103047","2001:558:feed::1","2601:14c:4302:90c0:5915:693a:b5c4:d777","DNS","152","Standard query response 0xc05f A fonts.googleapis.com CNAME googleadapis.l.google.com A 172.217.7.234"
"162","5.103051","2604:a880:400:d0::2221:3001","2601:14c:4302:90c0:5915:693a:b5c4:d777","ICMPv6","134","Destination Unreachable (Port unreachable)"
"163","5.103445","2601:14c:4302:90c0:5915:693a:b5c4:d777","2001:558:feed::1","DNS","103","Standard query 0x008b AAAA maxcdn.bootstrapcdn.com"
"164","5.106724","2601:14c:4302:90c0:5915:693a:b5c4:d777","2607:f8b0:4004:802::200a","QUIC","1412","Client Hello, PKN: 1, CID: 5147302960061399962"
"165","5.109054","2400:cb00:2048:1::6819:da15","2601:14c:4302:90c0:5915:693a:b5c4:d777","TCP","74","443  >  61695 [ACK] Seq=1 Ack=158 Win=29 Len=0"
"166","5.109547","2400:cb00:2048:1::6819:da15","2601:14c:4302:90c0:5915:693a:b5c4:d777","TLSv1.2","120","Application Data"
"167","5.109600","2601:14c:4302:90c0:5915:693a:b5c4:d777","2400:cb00:2048:1::6819:da15","TCP","74","61695  >  443 [ACK] Seq=158 Ack=47 Win=8190 Len=0"
"168","5.110892","2001:558:feed::1","2601:14c:4302:90c0:5915:693a:b5c4:d777","DNS","182","Standard query response 0x1b6b AAAA eue.collect-opnet.com SOA ns-616.awsdns-13.net"
"169","5.111748","2001:558:feed::1","2601:14c:4302:90c0:5915:693a:b5c4:d777","DNS","164","Standard query response 0x23e2 A ssl.google-analytics.com CNAME ssl-google-analytics.l.google.com A 172.217.7.136"
"170","5.113362","2001:558:feed::1","2601:14c:4302:90c0:5915:693a:b5c4:d777","DNS","176","Standard query response 0xbc9d AAAA ssl.google-analytics.com CNAME ssl-google-analytics.l.google.com AAAA 2607:f8b0:4004:800::2008"
"171","5.116437","2601:14c:4302:90c0:5915:693a:b5c4:d777","2607:f8b0:4004:800::2008","QUIC","1412","Client Hello, PKN: 1, CID: 17664169890371055754"
"172","5.119867","2607:f8b0:4004:80f::200a","2601:14c:4302:90c0:5915:693a:b5c4:d777","QUIC","1412","Payload (Encrypted), PKN: 1"
"173","5.120271","2607:f8b0:4004:80f::200a","2601:14c:4302:90c0:5915:693a:b5c4:d777","QUIC","93","Payload (Encrypted), PKN: 2"
"174","5.120413","2601:14c:4302:90c0:5915:693a:b5c4:d777","2607:f8b0:4004:80f::200a","QUIC","101","Payload (Encrypted), PKN: 2, CID: 14202550144851529852"
"175","5.120452","2601:14c:4302:90c0:5915:693a:b5c4:d777","2607:f8b0:4004:80f::200a","QUIC","100","Payload (Encrypted), PKN: 3, CID: 14202550144851529852"
"176","5.122052","2001:558:feed::1","2601:14c:4302:90c0:5915:693a:b5c4:d777","DNS","182","Standard query response 0x9f72 A maxcdn.bootstrapcdn.com CNAME bootstrapcdn.jdorfman.netdna-cdn.com A 94.31.29.55 A 198.232.125.123"
"177","5.123341","2001:558:feed::1","2601:14c:4302:90c0:5915:693a:b5c4:d777","DNS","215","Standard query response 0x008b AAAA maxcdn.bootstrapcdn.com CNAME bootstrapcdn.jdorfman.netdna-cdn.com SOA dns1.p04.nsone.net"
"178","5.123567","10.0.0.7","94.31.29.55","TCP","78","61712  >  443 [SYN] Seq=0 Win=65535 Len=0 MSS=1460 WS=32 TSval=113527473 TSecr=0 SACK_PERM=1"
"179","5.123833","2001:558:feed::1","2601:14c:4302:90c0:5915:693a:b5c4:d777","DNS","133","Standard query response 0xe706 A eue.collect-opnet.com A 54.235.65.212 A 50.17.197.98"
"180","5.123987","10.0.0.7","54.235.65.212","TCP","78","61713  >  443 [SYN] Seq=0 Win=65535 Len=0 MSS=1460 WS=32 TSval=113527473 TSecr=0 SACK_PERM=1"
"181","5.124042","10.0.0.7","54.235.65.212","TCP","78","61714  >  443 [SYN] Seq=0 Win=65535 Len=0 MSS=1460 WS=32 TSval=113527473 TSecr=0 SACK_PERM=1"
"182","5.124094","10.0.0.7","54.235.65.212","TCP","78","61715  >  443 [SYN] Seq=0 Win=65535 Len=0 MSS=1460 WS=32 TSval=113527473 TSecr=0 SACK_PERM=1"
"183","5.135252","2607:f8b0:4004:802::200a","2601:14c:4302:90c0:5915:693a:b5c4:d777","QUIC","1412","Payload (Encrypted), PKN: 1"
"184","5.135269","2601:14c:4302:90c0:5915:693a:b5c4:d777","2607:f8b0:4004:802::200a","QUIC","1412","Client Hello, PKN: 2, CID: 5147302960061399962"
"185","5.135633","2601:14c:4302:90c0:5915:693a:b5c4:d777","2607:f8b0:4004:802::200a","QUIC","101","Payload (Encrypted), PKN: 3, CID: 5147302960061399962"
"186","5.135693","2601:14c:4302:90c0:5915:693a:b5c4:d777","2607:f8b0:4004:802::200a","QUIC","97","Payload (Encrypted), PKN: 4, CID: 5147302960061399962"
"187","5.136482","94.31.29.55","10.0.0.7","TCP","66","443  >  61712 [SYN, ACK] Seq=0 Ack=1 Win=29200 Len=0 MSS=1460 SACK_PERM=1 WS=1024"
"188","5.136541","10.0.0.7","94.31.29.55","TCP","54","61712  >  443 [ACK] Seq=1 Ack=1 Win=262144 Len=0"
"189","5.136604","2607:f8b0:4004:802::200a","2601:14c:4302:90c0:5915:693a:b5c4:d777","QUIC","93","Payload (Encrypted), PKN: 2"
"190","5.136609","2607:f8b0:4004:80f::200a","2601:14c:4302:90c0:5915:693a:b5c4:d777","QUIC","92","Payload (Encrypted), PKN: 3"
"191","5.136768","10.0.0.7","94.31.29.55","TLSv1.2","571","Client Hello"
"192","5.142138","2601:14c:4302:90c0:5915:693a:b5c4:d777","2607:f8b0:4004:800::2008","QUIC","1412","Client Hello, PKN: 2, CID: 17664169890371055754"
"193","5.146715","54.235.65.212","10.0.0.7","TCP","74","443  >  61714 [SYN, ACK] Seq=0 Ack=1 Win=28960 Len=0 MSS=1460 SACK_PERM=1 TSval=918133388 TSecr=113527473 WS=256"
"194","5.146773","10.0.0.7","54.235.65.212","TCP","66","61714  >  443 [ACK] Seq=1 Ack=1 Win=131744 Len=0 TSval=113527495 TSecr=918133388"
"195","5.146944","10.0.0.7","54.235.65.212","TLSv1","307","Client Hello"
"196","5.147206","54.235.65.212","10.0.0.7","TCP","74","443  >  61713 [SYN, ACK] Seq=0 Ack=1 Win=28960 Len=0 MSS=1460 SACK_PERM=1 TSval=918133388 TSecr=113527473 WS=256"
"197","5.147211","54.235.65.212","10.0.0.7","TCP","74","443  >  61715 [SYN, ACK] Seq=0 Ack=1 Win=28960 Len=0 MSS=1460 SACK_PERM=1 TSval=918133388 TSecr=113527473 WS=256"
"198","5.147212","2607:f8b0:4004:800::2008","2601:14c:4302:90c0:5915:693a:b5c4:d777","QUIC","1412","Payload (Encrypted), PKN: 1"
"199","5.147249","2607:f8b0:4004:800::2008","2601:14c:4302:90c0:5915:693a:b5c4:d777","QUIC","93","Payload (Encrypted), PKN: 2"
"200","5.147288","10.0.0.7","54.235.65.212","TCP","66","61713  >  443 [ACK] Seq=1 Ack=1 Win=131744 Len=0 TSval=113527495 TSecr=918133388"
"201","5.147297","10.0.0.7","54.235.65.212","TCP","66","61715  >  443 [ACK] Seq=1 Ack=1 Win=131744 Len=0 TSval=113527495 TSecr=918133388"
"202","5.147429","10.0.0.7","54.235.65.212","TLSv1","307","Client Hello"
"203","5.147557","10.0.0.7","54.235.65.212","TLSv1","307","Client Hello"
"204","5.152136","2607:f8b0:4004:802::200a","2601:14c:4302:90c0:5915:693a:b5c4:d777","QUIC","92","Payload (Encrypted), PKN: 3"
"205","5.152141","94.31.29.55","10.0.0.7","TCP","60","443  >  61712 [ACK] Seq=1 Ack=518 Win=30720 Len=0"
"206","5.153588","94.31.29.55","10.0.0.7","TLSv1.2","1514","Server Hello"
"207","5.154075","94.31.29.55","10.0.0.7","TLSv1.2","1514","Certificate[TCP segment of a reassembled PDU]"
"208","5.154079","94.31.29.55","10.0.0.7","TLSv1.2","85","Server Key Exchange, Server Hello Done"
"209","5.154138","10.0.0.7","94.31.29.55","TCP","54","61712  >  443 [ACK] Seq=518 Ack=2921 Win=260672 Len=0"
"210","5.154138","10.0.0.7","94.31.29.55","TCP","54","61712  >  443 [ACK] Seq=518 Ack=2952 Win=262112 Len=0"
"211","5.155295","10.0.0.7","94.31.29.55","TLSv1.2","180","Client Key Exchange, Change Cipher Spec, Hello Request, Hello Request"
"212","5.162556","2601:14c:4302:90c0:5915:693a:b5c4:d777","2607:f8b0:4004:802::200a","QUIC","100","Payload (Encrypted), PKN: 5, CID: 5147302960061399962"
"213","5.163416","2607:f8b0:4004:800::2008","2601:14c:4302:90c0:5915:693a:b5c4:d777","QUIC","1412","Payload (Encrypted), PKN: 3"
"214","5.164004","2601:14c:4302:90c0:5915:693a:b5c4:d777","2607:f8b0:4004:800::2008","QUIC","101","Payload (Encrypted), PKN: 3, CID: 17664169890371055754"
"215","5.164035","2601:14c:4302:90c0:5915:693a:b5c4:d777","2607:f8b0:4004:800::2008","QUIC","97","Payload (Encrypted), PKN: 4, CID: 17664169890371055754"
"216","5.165326","54.235.65.212","10.0.0.7","TCP","66","443  >  61714 [ACK] Seq=1 Ack=242 Win=30208 Len=0 TSval=918133394 TSecr=113527495"
"217","5.165922","54.235.65.212","10.0.0.7","TCP","66","443  >  61713 [ACK] Seq=1 Ack=242 Win=30208 Len=0 TSval=918133394 TSecr=113527495"
"218","5.165927","54.235.65.212","10.0.0.7","TCP","66","443  >  61715 [ACK] Seq=1 Ack=242 Win=30208 Len=0 TSval=918133394 TSecr=113527495"
"219","5.165928","54.235.65.212","10.0.0.7","TLSv1","1514","Server Hello"
"220","5.166001","54.235.65.212","10.0.0.7","TCP","1514","[TCP segment of a reassembled PDU]"
"221","5.166047","10.0.0.7","54.235.65.212","TCP","66","61714  >  443 [ACK] Seq=242 Ack=2897 Win=129600 Len=0 TSval=113527512 TSecr=918133394"
"222","5.166804","54.235.65.212","10.0.0.7","TCP","1514","[TCP segment of a reassembled PDU]"
"223","5.166808","54.235.65.212","10.0.0.7","TLSv1","605","Certificate, Server Hello Done"
"224","5.166842","54.235.65.212","10.0.0.7","TLSv1","1514","Server Hello"
"225","5.166883","10.0.0.7","54.235.65.212","TCP","66","61714  >  443 [ACK] Seq=242 Ack=4884 Win=129056 Len=0 TSval=113527513 TSecr=918133394"
"226","5.166953","54.235.65.212","10.0.0.7","TCP","1514","[TCP segment of a reassembled PDU]"
"227","5.166982","10.0.0.7","54.235.65.212","TCP","66","61713  >  443 [ACK] Seq=242 Ack=2897 Win=128864 Len=0 TSval=113527513 TSecr=918133394"
"228","5.167027","54.235.65.212","10.0.0.7","TLSv1","1514","Server Hello"
"229","5.167683","54.235.65.212","10.0.0.7","TCP","1514","[TCP segment of a reassembled PDU]"
"230","5.167728","10.0.0.7","54.235.65.212","TCP","66","61715  >  443 [ACK] Seq=242 Ack=2897 Win=128864 Len=0 TSval=113527513 TSecr=918133394"
"231","5.167865","10.0.0.7","54.235.65.212","TLSv1","392","Client Key Exchange, Change Cipher Spec, Encrypted Handshake Message"
"232","5.168343","54.235.65.212","10.0.0.7","TCP","1514","[TCP segment of a reassembled PDU]"
"233","5.168346","54.235.65.212","10.0.0.7","TLSv1","605","Certificate, Server Hello Done"
"234","5.168442","54.235.65.212","10.0.0.7","TCP","1514","[TCP segment of a reassembled PDU]"
"235","5.168445","54.235.65.212","10.0.0.7","TLSv1","605","Certificate, Server Hello Done"
"236","5.168480","10.0.0.7","54.235.65.212","TCP","66","61713  >  443 [ACK] Seq=242 Ack=4884 Win=129056 Len=0 TSval=113527514 TSecr=918133394"
"237","5.168480","10.0.0.7","54.235.65.212","TCP","66","61715  >  443 [ACK] Seq=242 Ack=4884 Win=129056 Len=0 TSval=113527514 TSecr=918133394"
"238","5.169136","94.31.29.55","10.0.0.7","TLSv1.2","328","New Session Ticket, Change Cipher Spec, Encrypted Handshake Message"
"239","5.169138","94.31.29.55","10.0.0.7","TLSv1.2","123","Application Data"
"240","5.169179","10.0.0.7","94.31.29.55","TCP","54","61712  >  443 [ACK] Seq=644 Ack=3226 Win=261856 Len=0"
"241","5.169180","10.0.0.7","94.31.29.55","TCP","54","61712  >  443 [ACK] Seq=644 Ack=3295 Win=261792 Len=0"
"242","5.169379","10.0.0.7","54.235.65.212","TLSv1","392","Client Key Exchange, Change Cipher Spec, Encrypted Handshake Message"
"243","5.170428","10.0.0.7","54.235.65.212","TLSv1","392","Client Key Exchange, Change Cipher Spec, Encrypted Handshake Message"
"244","5.177137","2607:f8b0:4004:800::2008","2601:14c:4302:90c0:5915:693a:b5c4:d777","QUIC","92","Payload (Encrypted), PKN: 4"
"245","5.181571","2607:f8b0:4004:800::2008","2601:14c:4302:90c0:5915:693a:b5c4:d777","QUIC","93","Payload (Encrypted), PKN: 5"
"246","5.181871","2601:14c:4302:90c0:5915:693a:b5c4:d777","2607:f8b0:4004:800::2008","QUIC","100","Payload (Encrypted), PKN: 5, CID: 17664169890371055754"
"247","5.184813","54.235.65.212","10.0.0.7","TLSv1","125","Change Cipher Spec, Encrypted Handshake Message"
"248","5.184879","10.0.0.7","54.235.65.212","TCP","66","61714  >  443 [ACK] Seq=568 Ack=4943 Win=131008 Len=0 TSval=113527530 TSecr=918133399"
"249","5.187610","54.235.65.212","10.0.0.7","TLSv1","125","Change Cipher Spec, Encrypted Handshake Message"
"250","5.187701","10.0.0.7","54.235.65.212","TCP","66","61713  >  443 [ACK] Seq=568 Ack=4943 Win=131008 Len=0 TSval=113527532 TSecr=918133400"
"251","5.190682","54.235.65.212","10.0.0.7","TLSv1","125","Change Cipher Spec, Encrypted Handshake Message"
"252","5.190761","10.0.0.7","54.235.65.212","TCP","66","61715  >  443 [ACK] Seq=568 Ack=4943 Win=131008 Len=0 TSval=113527535 TSecr=918133401"
"253","5.200103","2400:cb00:2048:1::6819:da15","2601:14c:4302:90c0:5915:693a:b5c4:d777","TLSv1.2","175","Application Data"
"254","5.200233","2601:14c:4302:90c0:5915:693a:b5c4:d777","2400:cb00:2048:1::6819:da15","TCP","74","61695  >  443 [ACK] Seq=158 Ack=148 Win=8188 Len=0"
"255","5.262814","2601:14c:4302:90c0:5915:693a:b5c4:d777","2400:cb00:2048:1::6819:da15","TLSv1.2","225","Application Data"
"256","5.263158","2601:14c:4302:90c0:5915:693a:b5c4:d777","2400:cb00:2048:1::6818:6e3b","TCP","74","61387  >  443 [ACK] Seq=1 Ack=1 Win=8192 Len=0"
"257","5.274902","2400:cb00:2048:1::6818:6e3b","2601:14c:4302:90c0:5915:693a:b5c4:d777","TCP","74","[TCP ACKed unseen segment] 443  >  61387 [ACK] Seq=1 Ack=2 Win=33 Len=0"
"258","5.313772","2400:cb00:2048:1::6819:da15","2601:14c:4302:90c0:5915:693a:b5c4:d777","TCP","74","443  >  61695 [ACK] Seq=148 Ack=309 Win=30 Len=0"
"259","5.321400","10.0.0.7","54.235.65.212","TCP","66","[TCP Retransmission] 61701  >  443 [FIN, ACK] Seq=1 Ack=1 Win=4096 Len=0 TSval=113527663 TSecr=918070515"
"260","5.321400","10.0.0.7","104.16.109.18","TCP","54","[TCP Retransmission] 61640  >  443 [FIN, ACK] Seq=2 Ack=1 Win=32768 Len=0"
"261","5.324845","10.0.0.7","104.16.3.9","TCP","54","[TCP Retransmission] 61649  >  443 [FIN, ACK] Seq=1 Ack=1 Win=8192 Len=0"
"262","5.325966","10.0.0.7","104.16.3.9","TCP","54","[TCP Retransmission] 61648  >  443 [FIN, ACK] Seq=1 Ack=1 Win=8192 Len=0"
"263","5.325991","10.0.0.7","23.34.1.71","TCP","66","[TCP Retransmission] 61645  >  443 [FIN, ACK] Seq=1 Ack=1 Win=4096 Len=0 TSval=113527667 TSecr=836787780"
"264","5.350022","2601:14c:4302:90c0:5915:693a:b5c4:d777","2001:558:feed::1","DNS","97","Standard query 0xb078 A fonts.gstatic.com"
"265","5.350185","2601:14c:4302:90c0:5915:693a:b5c4:d777","2001:558:feed::1","DNS","97","Standard query 0x1cbc AAAA fonts.gstatic.com"
"266","5.363286","2001:558:feed::1","2601:14c:4302:90c0:5915:693a:b5c4:d777","DNS","161","Standard query response 0x1cbc AAAA fonts.gstatic.com CNAME gstaticadssl.l.google.com AAAA 2607:f8b0:4004:805::2003"
"267","5.364546","2001:558:feed::1","2601:14c:4302:90c0:5915:693a:b5c4:d777","DNS","149","Standard query response 0xb078 A fonts.gstatic.com CNAME gstaticadssl.l.google.com A 216.58.217.67"
"268","5.366105","10.0.0.7","104.17.31.15","TCP","54","[TCP Retransmission] 61643  >  443 [FIN, ACK] Seq=1 Ack=1 Win=8192 Len=0"
"269","5.370657","2601:14c:4302:90c0:5915:693a:b5c4:d777","2607:f8b0:4004:805::2003","QUIC","1412","Client Hello, PKN: 1, CID: 7104985190495894618"
"270","5.378365","2601:14c:4302:90c0:5915:693a:b5c4:d777","2604:a880:400:d0::2221:3001","TCP","86","[TCP Retransmission] 61702  >  443 [FIN, ACK] Seq=1 Ack=1 Win=32768 Len=0 TSval=113527719 TSecr=38782571"
"271","5.378681","2400:cb00:2048:1::6819:da15","2601:14c:4302:90c0:5915:693a:b5c4:d777","TLSv1.2","1016","Application Data"
"272","5.378745","2601:14c:4302:90c0:5915:693a:b5c4:d777","2400:cb00:2048:1::6819:da15","TCP","74","61695  >  443 [ACK] Seq=309 Ack=1090 Win=8162 Len=0"
"273","5.380015","2400:cb00:2048:1::6819:da15","2601:14c:4302:90c0:5915:693a:b5c4:d777","TLSv1.2","112","Application Data"
"274","5.380087","2601:14c:4302:90c0:5915:693a:b5c4:d777","2400:cb00:2048:1::6819:da15","TCP","74","61695  >  443 [ACK] Seq=309 Ack=1128 Win=8190 Len=0"
"275","5.390761","2601:14c:4302:90c0:5915:693a:b5c4:d777","2607:f8b0:4004:805::2003","QUIC","1412","Client Hello, PKN: 2, CID: 7104985190495894618"
"276","5.394726","2607:f8b0:4004:805::2003","2601:14c:4302:90c0:5915:693a:b5c4:d777","QUIC","1412","Payload (Encrypted), PKN: 1"
"277","5.395091","2607:f8b0:4004:805::2003","2601:14c:4302:90c0:5915:693a:b5c4:d777","QUIC","93","Payload (Encrypted), PKN: 2"
"278","5.396216","2601:14c:4302:90c0:5915:693a:b5c4:d777","2607:f8b0:4004:805::2003","QUIC","101","Payload (Encrypted), PKN: 3, CID: 7104985190495894618"
"279","5.396494","2601:14c:4302:90c0:5915:693a:b5c4:d777","2607:f8b0:4004:805::2003","QUIC","100","Payload (Encrypted), PKN: 4, CID: 7104985190495894618"
"280","5.398248","2604:a880:400:d0::2221:3001","2601:14c:4302:90c0:5915:693a:b5c4:d777","ICMPv6","134","Destination Unreachable (Port unreachable)"
"281","5.400434","2601:14c:4302:90c0:5915:693a:b5c4:d777","2400:cb00:2048:1::6819:da15","TLSv1.2","166","Application Data"
"282","5.402974","10.0.0.7","52.41.196.250","TCP","66","[TCP Retransmission] 61635  >  443 [FIN, ACK] Seq=1 Ack=1 Win=4096 Len=0 TSval=113527742 TSecr=6792228"
"283","5.408693","2607:f8b0:4004:805::2003","2601:14c:4302:90c0:5915:693a:b5c4:d777","QUIC","92","Payload (Encrypted), PKN: 3"
"284","5.416139","2400:cb00:2048:1::6819:da15","2601:14c:4302:90c0:5915:693a:b5c4:d777","TCP","74","443  >  61695 [ACK] Seq=1128 Ack=401 Win=30 Len=0"
"285","5.417213","2400:cb00:2048:1::6819:da15","2601:14c:4302:90c0:5915:693a:b5c4:d777","TCP","1294","[TCP segment of a reassembled PDU]"
"286","5.417618","2400:cb00:2048:1::6819:da15","2601:14c:4302:90c0:5915:693a:b5c4:d777","TLSv1.2","252","Application Data"
"287","5.417696","2400:cb00:2048:1::6819:da15","2601:14c:4302:90c0:5915:693a:b5c4:d777","TCP","1294","[TCP segment of a reassembled PDU]"
"288","5.417715","2601:14c:4302:90c0:5915:693a:b5c4:d777","2400:cb00:2048:1::6819:da15","TCP","74","61695  >  443 [ACK] Seq=401 Ack=2526 Win=8186 Len=0"
"289","5.418369","2400:cb00:2048:1::6819:da15","2601:14c:4302:90c0:5915:693a:b5c4:d777","TLSv1.2","1086","Application Data, Application Data"
"290","5.418374","2400:cb00:2048:1::6819:da15","2601:14c:4302:90c0:5915:693a:b5c4:d777","TLSv1.2","112","Application Data"
"291","5.418415","2601:14c:4302:90c0:5915:693a:b5c4:d777","2400:cb00:2048:1::6819:da15","TCP","74","61695  >  443 [ACK] Seq=401 Ack=4758 Win=8160 Len=0"
"292","5.418436","2601:14c:4302:90c0:5915:693a:b5c4:d777","2400:cb00:2048:1::6819:da15","TCP","74","61695  >  443 [ACK] Seq=401 Ack=4796 Win=8159 Len=0"
"293","5.519436","Technico_57:12:15","Broadcast","ARP","60","Who has 10.0.0.13? Tell 10.0.0.1"
"294","5.532931","10.0.0.7","35.162.141.229","TCP","66","[TCP Retransmission] 61694  >  80 [FIN, ACK] Seq=1 Ack=1 Win=4096 Len=0 TSval=113527870 TSecr=6773471"
"295","5.588381","10.0.0.7","54.235.65.212","TCP","66","[TCP Retransmission] 61701  >  443 [FIN, ACK] Seq=1 Ack=1 Win=4096 Len=0 TSval=113527925 TSecr=918070515"
"296","5.588382","10.0.0.7","104.16.109.18","TCP","54","[TCP Retransmission] 61640  >  443 [FIN, ACK] Seq=2 Ack=1 Win=32768 Len=0"
"297","5.597538","10.0.0.7","104.16.3.9","TCP","54","[TCP Retransmission] 61649  >  443 [FIN, ACK] Seq=1 Ack=1 Win=8192 Len=0"
"298","5.600869","10.0.0.7","104.16.3.9","TCP","54","[TCP Retransmission] 61648  >  443 [FIN, ACK] Seq=1 Ack=1 Win=8192 Len=0"
"299","5.600870","10.0.0.7","23.34.1.71","TCP","66","[TCP Retransmission] 61645  >  443 [FIN, ACK] Seq=1 Ack=1 Win=4096 Len=0 TSval=113527937 TSecr=836787780"
"300","5.621939","Technico_57:12:15","Broadcast","ARP","60","Who has 10.0.0.11? Tell 10.0.0.1"
"301","5.622997","Technico_57:12:15","Broadcast","ARP","60","Who has 10.0.0.8? Tell 10.0.0.1"
"302","5.624152","Technico_57:12:15","Broadcast","ARP","60","Who has 10.0.0.20? Tell 10.0.0.1"
"303","5.703772","2601:14c:4302:90c0:5915:693a:b5c4:d777","2001:558:feed::1","DNS","99","Standard query 0x7da8 A clients4.google.com"
"304","5.703994","2601:14c:4302:90c0:5915:693a:b5c4:d777","2001:558:feed::1","DNS","99","Standard query 0x147c AAAA clients4.google.com"
"305","5.716622","2001:558:feed::1","2601:14c:4302:90c0:5915:693a:b5c4:d777","DNS","139","Standard query response 0x7da8 A clients4.google.com CNAME clients.l.google.com A 172.217.12.142"
"306","5.720257","10.0.0.7","104.17.31.15","TCP","54","[TCP Retransmission] 61643  >  443 [FIN, ACK] Seq=1 Ack=1 Win=8192 Len=0"
"307","5.723457","2001:558:feed::1","2601:14c:4302:90c0:5915:693a:b5c4:d777","DNS","151","Standard query response 0x147c AAAA clients4.google.com CNAME clients.l.google.com AAAA 2607:f8b0:4004:80b::200e"
"308","5.727290","2601:14c:4302:90c0:5915:693a:b5c4:d777","2607:f8b0:4004:80b::200e","QUIC","1412","Client Hello, PKN: 1, CID: 4944212872910334978"
"309","5.727636","2601:14c:4302:90c0:5915:693a:b5c4:d777","2001:558:feed::1","DNS","99","Standard query 0x79c2 A clients4.google.com"
"310","5.727797","2601:14c:4302:90c0:5915:693a:b5c4:d777","2001:558:feed::1","DNS","99","Standard query 0x1ede AAAA clients4.google.com"
"311","5.740942","2001:558:feed::1","2601:14c:4302:90c0:5915:693a:b5c4:d777","DNS","139","Standard query response 0x79c2 A clients4.google.com CNAME clients.l.google.com A 172.217.7.142"
"312","5.743651","2607:f8b0:4004:80b::200e","2601:14c:4302:90c0:5915:693a:b5c4:d777","QUIC","1412","Payload (Encrypted), PKN: 1"
"313","5.744030","2607:f8b0:4004:80b::200e","2601:14c:4302:90c0:5915:693a:b5c4:d777","QUIC","93","Payload (Encrypted), PKN: 2"
"314","5.744705","2601:14c:4302:90c0:5915:693a:b5c4:d777","2607:f8b0:4004:80b::200e","QUIC","101","Payload (Encrypted), PKN: 2, CID: 4944212872910334978"
"315","5.744872","2601:14c:4302:90c0:5915:693a:b5c4:d777","2607:f8b0:4004:80b::200e","QUIC","100","Payload (Encrypted), PKN: 3, CID: 4944212872910334978"
"316","5.745045","2601:14c:4302:90c0:5915:693a:b5c4:d777","2607:f8b0:4004:80b::200e","QUIC","480","Payload (Encrypted), PKN: 4, CID: 4944212872910334978"
"317","5.745082","2601:14c:4302:90c0:5915:693a:b5c4:d777","2607:f8b0:4004:80b::200e","QUIC","1412","Payload (Encrypted), PKN: 5, CID: 4944212872910334978"
"318","5.745188","2601:14c:4302:90c0:5915:693a:b5c4:d777","2607:f8b0:4004:80b::200e","QUIC","911","Payload (Encrypted), PKN: 6, CID: 4944212872910334978"
"319","5.745833","2001:558:feed::1","2601:14c:4302:90c0:5915:693a:b5c4:d777","DNS","151","Standard query response 0x1ede AAAA clients4.google.com CNAME clients.l.google.com AAAA 2607:f8b0:4004:805::200e"
"320","5.746279","2601:14c:4302:90c0:5915:693a:b5c4:d777","2607:f8b0:4004:805::200e","TCP","98","61716  >  443 [SYN] Seq=0 Win=65535 Len=0 MSS=1440 WS=32 TSval=113528080 TSecr=0 SACK_PERM=1"
"321","5.757148","2607:f8b0:4004:80b::200e","2601:14c:4302:90c0:5915:693a:b5c4:d777","QUIC","92","Payload (Encrypted), PKN: 3"
"322","5.758516","2607:f8b0:4004:805::200e","2601:14c:4302:90c0:5915:693a:b5c4:d777","TCP","94","443  >  61716 [SYN, ACK] Seq=0 Ack=1 Win=26960 Len=0 MSS=1360 SACK_PERM=1 TSval=2066455140 TSecr=113528080 WS=128"
"323","5.758607","2601:14c:4302:90c0:5915:693a:b5c4:d777","2607:f8b0:4004:805::200e","TCP","86","61716  >  443 [ACK] Seq=1 Ack=1 Win=132096 Len=0 TSval=113528092 TSecr=2066455140"
"324","5.758749","2601:14c:4302:90c0:5915:693a:b5c4:d777","2607:f8b0:4004:805::200e","TLSv1.2","603","Client Hello"
"325","5.758868","2607:f8b0:4004:80b::200e","2601:14c:4302:90c0:5915:693a:b5c4:d777","QUIC","95","Payload (Encrypted), PKN: 4"
"326","5.759427","2601:14c:4302:90c0:5915:693a:b5c4:d777","2604:a880:400:d0::2221:3001","TCP","86","[TCP Retransmission] 61702  >  443 [FIN, ACK] Seq=1 Ack=1 Win=32768 Len=0 TSval=113528093 TSecr=38782571"
"327","5.773413","2607:f8b0:4004:805::200e","2601:14c:4302:90c0:5915:693a:b5c4:d777","TCP","86","443  >  61716 [ACK] Seq=1 Ack=518 Win=28032 Len=0 TSval=2066455155 TSecr=113528092"
"328","5.773934","2607:f8b0:4004:805::200e","2601:14c:4302:90c0:5915:693a:b5c4:d777","TLSv1.2","242","Server Hello, Change Cipher Spec, Hello Request, Hello Request"
"329","5.774003","2601:14c:4302:90c0:5915:693a:b5c4:d777","2607:f8b0:4004:805::200e","TCP","86","61716  >  443 [ACK] Seq=518 Ack=157 Win=131936 Len=0 TSval=113528107 TSecr=2066455156"
"330","5.774160","2601:14c:4302:90c0:5915:693a:b5c4:d777","2607:f8b0:4004:805::200e","TLSv1.2","137","Change Cipher Spec, Hello Request, Hello Request"
"331","5.776007","2601:14c:4302:90c0:5915:693a:b5c4:d777","2607:f8b0:4004:805::200e","TLSv1.2","139","Application Data"
"332","5.776047","2601:14c:4302:90c0:5915:693a:b5c4:d777","2607:f8b0:4004:805::200e","TLSv1.2","142","Application Data"
"333","5.776047","2601:14c:4302:90c0:5915:693a:b5c4:d777","2607:f8b0:4004:805::200e","TLSv1.2","128","Application Data"
"334","5.779393","2604:a880:400:d0::2221:3001","2601:14c:4302:90c0:5915:693a:b5c4:d777","ICMPv6","134","Destination Unreachable (Port unreachable)"
"335","5.785130","2607:f8b0:4004:80b::200e","2601:14c:4302:90c0:5915:693a:b5c4:d777","QUIC","89","Payload (Encrypted), PKN: 5"
"336","5.787964","2607:f8b0:4004:805::200e","2601:14c:4302:90c0:5915:693a:b5c4:d777","TLSv1.2","142","Application Data"
"337","5.788034","2601:14c:4302:90c0:5915:693a:b5c4:d777","2607:f8b0:4004:805::200e","TCP","86","61716  >  443 [ACK] Seq=720 Ack=213 Win=131872 Len=0 TSval=113528121 TSecr=2066455170"
"338","5.788141","2601:14c:4302:90c0:5915:693a:b5c4:d777","2607:f8b0:4004:805::200e","TLSv1.2","124","Application Data"
"339","5.788327","2607:f8b0:4004:805::200e","2601:14c:4302:90c0:5915:693a:b5c4:d777","TLSv1.2","128","Application Data"
"340","5.788366","2601:14c:4302:90c0:5915:693a:b5c4:d777","2607:f8b0:4004:805::200e","TCP","86","61716  >  443 [ACK] Seq=758 Ack=255 Win=131840 Len=0 TSval=113528121 TSecr=2066455170"
"341","5.789055","2607:f8b0:4004:805::200e","2601:14c:4302:90c0:5915:693a:b5c4:d777","TCP","86","443  >  61716 [ACK] Seq=255 Ack=720 Win=28032 Len=0 TSval=2066455170 TSecr=113528109"
"342","5.789058","2607:f8b0:4004:805::200e","2601:14c:4302:90c0:5915:693a:b5c4:d777","TLSv1.2","124","Application Data"
"343","5.789106","2601:14c:4302:90c0:5915:693a:b5c4:d777","2607:f8b0:4004:805::200e","TCP","86","61716  >  443 [ACK] Seq=758 Ack=293 Win=131808 Len=0 TSval=113528122 TSecr=2066455170"
"344","5.830497","10.0.0.7","52.41.196.250","TCP","66","[TCP Retransmission] 61635  >  443 [FIN, ACK] Seq=1 Ack=1 Win=4096 Len=0 TSval=113528162 TSecr=6792228"
"345","5.836171","2601:14c:4302:90c0:5915:693a:b5c4:d777","2607:f8b0:4004:805::200e","TCP","124","[TCP Retransmission] 61716  >  443 [PSH, ACK] Seq=720 Ack=293 Win=131808 Len=38 TSval=113528167 TSecr=2066455170"
"346","5.838336","fe80::9c:6c7:586:a22","fe80::c627:95ff:fe57:1215","ICMPv6","86","Neighbor Solicitation for fe80::c627:95ff:fe57:1215 from 00:23:12:13:5a:55"
"347","5.840299","fe80::c627:95ff:fe57:1215","fe80::9c:6c7:586:a22","ICMPv6","78","Neighbor Advertisement fe80::c627:95ff:fe57:1215 (rtr, sol)"
"348","5.842422","2607:f8b0:4004:805::200e","2601:14c:4302:90c0:5915:693a:b5c4:d777","TCP","86","443  >  61716 [ACK] Seq=293 Ack=758 Win=28032 Len=0 TSval=2066455224 TSecr=113528121"
"349","5.848150","2607:f8b0:4004:805::200e","2601:14c:4302:90c0:5915:693a:b5c4:d777","TCP","98","[TCP Dup ACK 348#1] 443  >  61716 [ACK] Seq=293 Ack=758 Win=28032 Len=0 TSval=2066455230 TSecr=113528167 SLE=720 SRE=758"
"350","5.898501","10.0.0.7","54.235.65.212","TLSv1","780","Application Data, Application Data"
"351","5.907983","2601:14c:4302:90c0:5915:693a:b5c4:d777","2400:cb00:2048:1::6819:da15","TLSv1.2","180","Application Data"
"352","5.911150","2607:f8b0:4004:80b::200e","2601:14c:4302:90c0:5915:693a:b5c4:d777","QUIC","393","Payload (Encrypted), PKN: 6"
"353","5.911523","2607:f8b0:4004:80b::200e","2601:14c:4302:90c0:5915:693a:b5c4:d777","QUIC","646","Payload (Encrypted), PKN: 7"
"354","5.911651","2601:14c:4302:90c0:5915:693a:b5c4:d777","2607:f8b0:4004:80b::200e","QUIC","109","Payload (Encrypted), PKN: 7, CID: 4944212872910334978"
"355","5.912278","2607:f8b0:4004:80b::200e","2601:14c:4302:90c0:5915:693a:b5c4:d777","QUIC","90","Payload (Encrypted), PKN: 8"
"356","5.913964","2601:14c:4302:90c0:5915:693a:b5c4:d777","2607:f8b0:4004:80b::200e","QUIC","200","Payload (Encrypted), PKN: 8, CID: 4944212872910334978"
"357","5.914061","54.235.65.212","10.0.0.7","TLSv1","327","Application Data"
"358","5.914079","2601:14c:4302:90c0:5915:693a:b5c4:d777","2607:f8b0:4004:80b::200e","QUIC","1344","Payload (Encrypted), PKN: 9, CID: 4944212872910334978"
"359","5.914120","10.0.0.7","54.235.65.212","TCP","66","61714  >  443 [ACK] Seq=1282 Ack=5204 Win=130784 Len=0 TSval=113528243 TSecr=918133582"
"360","5.914911","2601:14c:4302:90c0:5915:693a:b5c4:d777","2001:558:feed::1","DNS","93","Standard query 0xd3ad A api.mywot.com"
"361","5.914968","2601:14c:4302:90c0:5915:693a:b5c4:d777","2001:558:feed::1","DNS","93","Standard query 0x674a AAAA api.mywot.com"
"362","5.920663","10.0.0.7","54.235.65.212","TCP","66","[TCP Retransmission] 61701  >  443 [FIN, ACK] Seq=1 Ack=1 Win=4096 Len=0 TSval=113528249 TSecr=918070515"
"363","5.920664","10.0.0.7","104.16.109.18","TCP","54","[TCP Retransmission] 61640  >  443 [FIN, ACK] Seq=2 Ack=1 Win=32768 Len=0"
"364","5.928240","2400:cb00:2048:1::6819:da15","2601:14c:4302:90c0:5915:693a:b5c4:d777","TCP","1294","[TCP segment of a reassembled PDU]"
"365","5.928671","2400:cb00:2048:1::6819:da15","2601:14c:4302:90c0:5915:693a:b5c4:d777","TLSv1.2","252","Application Data"
"366","5.928719","2601:14c:4302:90c0:5915:693a:b5c4:d777","2400:cb00:2048:1::6819:da15","TCP","74","61695  >  443 [ACK] Seq=507 Ack=6194 Win=8186 Len=0"
"367","5.928809","2400:cb00:2048:1::6819:da15","2601:14c:4302:90c0:5915:693a:b5c4:d777","TCP","1294","[TCP segment of a reassembled PDU]"
"368","5.928814","2400:cb00:2048:1::6819:da15","2601:14c:4302:90c0:5915:693a:b5c4:d777","TLSv1.2","1294","Application Data[TCP segment of a reassembled PDU]"
"369","5.928855","2400:cb00:2048:1::6819:da15","2601:14c:4302:90c0:5915:693a:b5c4:d777","TLSv1.2","430","Application Data"
"370","5.928864","2601:14c:4302:90c0:5915:693a:b5c4:d777","2400:cb00:2048:1::6819:da15","TCP","74","61695  >  443 [ACK] Seq=507 Ack=8634 Win=8115 Len=0"
"371","5.928891","2601:14c:4302:90c0:5915:693a:b5c4:d777","2400:cb00:2048:1::6819:da15","TCP","74","61695  >  443 [ACK] Seq=507 Ack=8990 Win=8104 Len=0"
"372","5.928951","2400:cb00:2048:1::6819:da15","2601:14c:4302:90c0:5915:693a:b5c4:d777","TCP","1294","[TCP segment of a reassembled PDU]"
"373","5.928955","2400:cb00:2048:1::6819:da15","2601:14c:4302:90c0:5915:693a:b5c4:d777","TLSv1.2","384","Application Data, Application Data, Application Data"
"374","5.928956","2607:f8b0:4004:80b::200e","2601:14c:4302:90c0:5915:693a:b5c4:d777","QUIC","95","Payload (Encrypted), PKN: 9"
"375","5.928992","2601:14c:4302:90c0:5915:693a:b5c4:d777","2400:cb00:2048:1::6819:da15","TCP","74","61695  >  443 [ACK] Seq=507 Ack=10520 Win=8056 Len=0"
"376","5.929014","2601:14c:4302:90c0:5915:693a:b5c4:d777","2400:cb00:2048:1::6819:da15","TCP","74","[TCP Window Update] 61695  >  443 [ACK] Seq=507 Ack=10520 Win=8192 Len=0"
"377","5.931738","2001:558:feed::1","2601:14c:4302:90c0:5915:693a:b5c4:d777","DNS","125","Standard query response 0xd3ad A api.mywot.com A 52.41.196.250 A 35.162.141.229"
"378","5.932088","2001:558:feed::1","2601:14c:4302:90c0:5915:693a:b5c4:d777","DNS","171","Standard query response 0x674a AAAA api.mywot.com SOA ns-170.awsdns-21.com"
"379","5.932407","10.0.0.7","52.41.196.250","TCP","78","61717  >  443 [SYN] Seq=0 Win=65535 Len=0 MSS=1460 WS=32 TSval=113528260 TSecr=0 SACK_PERM=1"
"380","5.943012","10.0.0.7","104.16.3.9","TCP","54","[TCP Retransmission] 61649  >  443 [FIN, ACK] Seq=1 Ack=1 Win=8192 Len=0"
"381","5.950078","10.0.0.7","104.16.3.9","TCP","54","[TCP Retransmission] 61648  >  443 [FIN, ACK] Seq=1 Ack=1 Win=8192 Len=0"
"382","5.950079","10.0.0.7","23.34.1.71","TCP","66","[TCP Retransmission] 61645  >  443 [FIN, ACK] Seq=1 Ack=1 Win=4096 Len=0 TSval=113528277 TSecr=836787780"
"383","5.955824","2601:14c:4302:90c0:5915:693a:b5c4:d777","2607:f8b0:4004:800::2008","QUIC","725","Payload (Encrypted), PKN: 6, CID: 17664169890371055754"
"384","5.970042","2607:f8b0:4004:800::2008","2601:14c:4302:90c0:5915:693a:b5c4:d777","QUIC","337","Payload (Encrypted), PKN: 6"
"385","5.970299","2601:14c:4302:90c0:5915:693a:b5c4:d777","2607:f8b0:4004:800::2008","QUIC","97","Payload (Encrypted), PKN: 7, CID: 17664169890371055754"
"386","5.994163","2607:f8b0:4004:800::2008","2601:14c:4302:90c0:5915:693a:b5c4:d777","QUIC","98","Payload (Encrypted), PKN: 7"
"387","6.030619","52.41.196.250","10.0.0.7","TCP","74","443  >  61717 [SYN, ACK] Seq=0 Ack=1 Win=26847 Len=0 MSS=1460 SACK_PERM=1 TSval=6855266 TSecr=113528260 WS=256"
"388","6.030743","10.0.0.7","52.41.196.250","TCP","66","61717  >  443 [ACK] Seq=1 Ack=1 Win=131744 Len=0 TSval=113528357 TSecr=6855266"
"389","6.031004","10.0.0.7","52.41.196.250","TLSv1.2","299","Client Hello"
"390","6.071941","2607:f8b0:4004:80b::200e","2601:14c:4302:90c0:5915:693a:b5c4:d777","QUIC","115","Payload (Encrypted), PKN: 10"
"391","6.072241","2607:f8b0:4004:80b::200e","2601:14c:4302:90c0:5915:693a:b5c4:d777","QUIC","432","Payload (Encrypted), PKN: 11"
"392","6.072486","2601:14c:4302:90c0:5915:693a:b5c4:d777","2607:f8b0:4004:80b::200e","QUIC","103","Payload (Encrypted), PKN: 10, CID: 4944212872910334978"
"393","6.072691","2607:f8b0:4004:80b::200e","2601:14c:4302:90c0:5915:693a:b5c4:d777","QUIC","90","Payload (Encrypted), PKN: 12"
"394","6.098290","2601:14c:4302:90c0:5915:693a:b5c4:d777","2607:f8b0:4004:80b::200e","QUIC","97","Payload (Encrypted), PKN: 11, CID: 4944212872910334978"
"395","6.133033","52.41.196.250","10.0.0.7","TCP","66","443  >  61717 [ACK] Seq=1 Ack=234 Win=28160 Len=0 TSval=6855291 TSecr=113528357"
"396","6.133620","52.41.196.250","10.0.0.7","TLSv1.2","1514","Server Hello"
"397","6.133626","52.41.196.250","10.0.0.7","TLSv1.2","1464","Certificate, Server Key Exchange, Server Hello Done"
"398","6.133716","10.0.0.7","52.41.196.250","TCP","66","61717  >  443 [ACK] Seq=234 Ack=2847 Win=128896 Len=0 TSval=113528459 TSecr=6855291"
"399","6.134966","10.0.0.7","52.41.196.250","TLSv1.2","192","Client Key Exchange, Change Cipher Spec, Hello Request, Hello Request"
"400","6.219782","10.0.0.7","35.162.141.229","TCP","66","[TCP Retransmission] 61694  >  80 [FIN, ACK] Seq=1 Ack=1 Win=4096 Len=0 TSval=113528544 TSecr=6773471"
"401","6.227361","10.0.0.7","104.17.31.15","TCP","54","[TCP Retransmission] 61643  >  443 [FIN, ACK] Seq=1 Ack=1 Win=8192 Len=0"
"402","6.235387","52.41.196.250","10.0.0.7","TLSv1.2","117","Change Cipher Spec, Encrypted Handshake Message"
"403","6.235456","10.0.0.7","52.41.196.250","TCP","66","61717  >  443 [ACK] Seq=360 Ack=2898 Win=131008 Len=0 TSval=113528559 TSecr=6855317"
"404","6.236792","10.0.0.7","52.41.196.250","TLSv1.2","955","Application Data"
"405","6.236792","10.0.0.7","52.41.196.250","TLSv1.2","1026","Application Data"
"406","6.310024","10.0.0.7","198.232.125.123","TCP","54","[TCP Retransmission] 61699  >  443 [FIN, ACK] Seq=1 Ack=1 Win=8192 Len=0"
"407","6.310025","10.0.0.7","198.232.125.123","TCP","54","[TCP Retransmission] 61697  >  443 [FIN, ACK] Seq=1 Ack=1 Win=8192 Len=0"
"408","6.318624","2601:14c:4302:90c0:5915:693a:b5c4:d777","2604:a880:400:d0::2221:3001","TCP","86","[TCP Retransmission] 61702  >  443 [FIN, ACK] Seq=1 Ack=1 Win=32768 Len=0 TSval=113528641 TSecr=38782571"
"409","6.337876","52.41.196.250","10.0.0.7","TCP","66","443  >  61717 [ACK] Seq=2898 Ack=2209 Win=31744 Len=0 TSval=6855342 TSecr=113528560"
"410","6.338410","52.41.196.250","10.0.0.7","TLSv1.2","1494","Application Data"
"411","6.338454","2604:a880:400:d0::2221:3001","2601:14c:4302:90c0:5915:693a:b5c4:d777","ICMPv6","134","Destination Unreachable (Port unreachable)"
"412","6.338500","10.0.0.7","52.41.196.250","TCP","66","61717  >  443 [ACK] Seq=2209 Ack=4326 Win=129632 Len=0 TSval=113528660 TSecr=6855343"
"413","6.375712","10.0.0.7","54.235.65.212","TCP","66","[TCP Retransmission] 61701  >  443 [FIN, ACK] Seq=1 Ack=1 Win=4096 Len=0 TSval=113528697 TSecr=918070515"
"414","6.375712","10.0.0.7","104.16.109.18","TCP","54","[TCP Retransmission] 61640  >  443 [FIN, ACK] Seq=2 Ack=1 Win=32768 Len=0"
"415","6.421758","10.0.0.7","104.16.3.9","TCP","54","[TCP Retransmission] 61649  >  443 [FIN, ACK] Seq=1 Ack=1 Win=8192 Len=0"
"416","6.436721","10.0.0.7","104.16.3.9","TCP","54","[TCP Retransmission] 61648  >  443 [FIN, ACK] Seq=1 Ack=1 Win=8192 Len=0"
"417","6.436722","10.0.0.7","23.34.1.71","TCP","66","[TCP Retransmission] 61645  >  443 [FIN, ACK] Seq=1 Ack=1 Win=4096 Len=0 TSval=113528757 TSecr=836787780"
"418","6.482702","10.0.0.7","52.41.196.250","TCP","66","[TCP Retransmission] 61635  >  443 [FIN, ACK] Seq=1 Ack=1 Win=4096 Len=0 TSval=113528803 TSecr=6792228"
"419","6.700397","10.0.0.7","23.64.65.225","TLSv1.2","428","Application Data"
"420","6.718880","23.64.65.225","10.0.0.7","TLSv1.2","376","Application Data"
"421","6.718974","10.0.0.7","23.64.65.225","TCP","66","61709  >  443 [ACK] Seq=1089 Ack=932 Win=4086 Len=0 TSval=113529038 TSecr=836975782"
"422","7.025752","10.0.0.7","104.17.31.15","TCP","54","[TCP Retransmission] 61643  >  443 [FIN, ACK] Seq=1 Ack=1 Win=8192 Len=0"
"423","7.075753","10.0.0.7","54.235.65.212","TCP","66","[TCP Retransmission] 61701  >  443 [FIN, ACK] Seq=1 Ack=1 Win=4096 Len=0 TSval=113529393 TSecr=918070515"
"424","7.075754","10.0.0.7","104.16.109.18","TCP","54","[TCP Retransmission] 61640  >  443 [FIN, ACK] Seq=2 Ack=1 Win=32768 Len=0"
"425","7.169797","10.0.0.7","104.16.3.9","TCP","54","[TCP Retransmission] 61649  >  443 [FIN, ACK] Seq=1 Ack=1 Win=8192 Len=0"
"426","7.199872","10.0.0.7","104.16.3.9","TCP","54","[TCP Retransmission] 61648  >  443 [FIN, ACK] Seq=1 Ack=1 Win=8192 Len=0"
"427","7.199872","10.0.0.7","23.34.1.71","TCP","66","[TCP Retransmission] 61645  >  443 [FIN, ACK] Seq=1 Ack=1 Win=4096 Len=0 TSval=113529517 TSecr=836787780"
"428","7.220077","2601:14c:4302:90c0:5915:693a:b5c4:d777","2604:a880:400:d0::2221:3001","TCP","86","[TCP Retransmission] 61702  >  443 [FIN, ACK] Seq=1 Ack=1 Win=32768 Len=0 TSval=113529537 TSecr=38782571"
"429","7.239977","2604:a880:400:d0::2221:3001","2601:14c:4302:90c0:5915:693a:b5c4:d777","ICMPv6","134","Destination Unreachable (Port unreachable)"
"430","7.376150","10.0.0.7","35.162.141.229","TCP","66","[TCP Retransmission] 61694  >  80 [FIN, ACK] Seq=1 Ack=1 Win=4096 Len=0 TSval=113529693 TSecr=6773471"
"431","7.566278","10.0.0.7","52.41.196.250","TCP","66","[TCP Retransmission] 61635  >  443 [FIN, ACK] Seq=1 Ack=1 Win=4096 Len=0 TSval=113529883 TSecr=6792228"
"432","8.237320","10.0.0.7","54.235.65.212","TCP","66","[TCP Retransmission] 61701  >  443 [FIN, ACK] Seq=1 Ack=1 Win=4096 Len=0 TSval=113530553 TSecr=918070515"
"433","8.237321","10.0.0.7","104.16.109.18","TCP","54","[TCP Retransmission] 61640  >  443 [FIN, ACK] Seq=2 Ack=1 Win=32768 Len=0"
"434","8.332378","10.0.0.7","104.16.3.9","TCP","54","[TCP Retransmission] 61649  >  443 [FIN, ACK] Seq=1 Ack=1 Win=8192 Len=0"
"435","8.362484","10.0.0.7","104.16.3.9","TCP","54","[TCP Retransmission] 61648  >  443 [FIN, ACK] Seq=1 Ack=1 Win=8192 Len=0"
"436","8.362485","10.0.0.7","23.34.1.71","TCP","66","[TCP Retransmission] 61645  >  443 [FIN, ACK] Seq=1 Ack=1 Win=4096 Len=0 TSval=113530678 TSecr=836787780"
"437","8.412728","10.0.0.7","104.17.31.15","TCP","54","[TCP Retransmission] 61643  >  443 [FIN, ACK] Seq=1 Ack=1 Win=8192 Len=0"
"438","8.518785","10.0.0.7","198.232.125.123","TCP","54","[TCP Retransmission] 61699  >  443 [FIN, ACK] Seq=1 Ack=1 Win=8192 Len=0"
"439","8.518786","10.0.0.7","198.232.125.123","TCP","54","[TCP Retransmission] 61697  >  443 [FIN, ACK] Seq=1 Ack=1 Win=8192 Len=0"
"440","8.782473","10.0.0.7","23.64.65.225","TLSv1.2","427","Application Data"
"441","8.801169","23.64.65.225","10.0.0.7","TLSv1.2","376","Application Data"
"442","8.801240","10.0.0.7","23.64.65.225","TCP","66","61709  >  443 [ACK] Seq=1450 Ack=1242 Win=4086 Len=0 TSval=113531115 TSecr=836977864"
"443","8.815976","2601:14c:4302:90c0:5915:693a:b5c4:d777","2604:a880:400:d0::2221:3001","TCP","86","[TCP Retransmission] 61702  >  443 [FIN, ACK] Seq=1 Ack=1 Win=32768 Len=0 TSval=113531129 TSecr=38782571"
"444","8.835526","2604:a880:400:d0::2221:3001","2601:14c:4302:90c0:5915:693a:b5c4:d777","ICMPv6","134","Destination Unreachable (Port unreachable)"
"445","9.477380","10.0.0.7","35.162.141.229","TCP","66","[TCP Retransmission] 61694  >  80 [FIN, ACK] Seq=1 Ack=1 Win=4096 Len=0 TSval=113531789 TSecr=6773471"
"446","9.532161","10.0.0.7","52.41.196.250","TCP","66","[TCP Retransmission] 61635  >  443 [FIN, ACK] Seq=1 Ack=1 Win=4096 Len=0 TSval=113531843 TSecr=6792228"
"447","9.978232","2601:14c:4302:90c0:5915:693a:b5c4:d777","2604:a880:400:d0::2221:3001","TCP","86","[TCP Retransmission] 61702  >  443 [FIN, ACK] Seq=1 Ack=1 Win=32768 Len=0 TSval=113532289 TSecr=38782571"
"448","10.000822","2604:a880:400:d0::2221:3001","2601:14c:4302:90c0:5915:693a:b5c4:d777","ICMPv6","134","Destination Unreachable (Port unreachable)"
"449","10.363446","10.0.0.7","54.235.65.212","TCP","66","[TCP Retransmission] 61701  >  443 [FIN, ACK] Seq=1 Ack=1 Win=4096 Len=0 TSval=113532673 TSecr=918070515"
"450","10.363583","10.0.0.7","104.16.109.18","TCP","54","[TCP Retransmission] 61640  >  443 [FIN, ACK] Seq=2 Ack=1 Win=32768 Len=0"
"451","10.454518","10.0.0.7","192.30.253.124","TCP","54","61350  >  443 [ACK] Seq=1 Ack=1 Win=4101 Len=0"
"452","10.459034","10.0.0.7","104.16.3.9","TCP","54","[TCP Retransmission] 61649  >  443 [FIN, ACK] Seq=1 Ack=1 Win=8192 Len=0"
"453","10.468119","192.30.253.124","10.0.0.7","TCP","66","[TCP ACKed unseen segment] 443  >  61350 [ACK] Seq=1 Ack=2 Win=31 Len=0 TSval=3327217489 TSecr=113487751"
"454","10.490125","10.0.0.7","104.16.3.9","TCP","54","[TCP Retransmission] 61648  >  443 [FIN, ACK] Seq=1 Ack=1 Win=8192 Len=0"
"455","10.490192","10.0.0.7","23.34.1.71","TCP","66","[TCP Retransmission] 61645  >  443 [FIN, ACK] Seq=1 Ack=1 Win=4096 Len=0 TSval=113532798 TSecr=836787780"
"456","10.537202","Technico_57:12:15","Broadcast","ARP","60","Who has 10.0.0.11? Tell 10.0.0.1"
"457","10.538343","Technico_57:12:15","Broadcast","ARP","60","Who has 10.0.0.15? Tell 10.0.0.1"
"458","10.539419","Technico_57:12:15","Broadcast","ARP","60","Who has 10.0.0.8? Tell 10.0.0.1"
"459","10.540235","10.0.0.7","104.17.31.15","TCP","54","[TCP Retransmission] 61643  >  443 [FIN, ACK] Seq=1 Ack=1 Win=8192 Len=0"
"460","10.540543","Technico_57:12:15","Broadcast","ARP","60","Who has 10.0.0.7? Tell 10.0.0.1"
"461","10.540580","Apple_13:5a:55","Technico_57:12:15","ARP","42","10.0.0.7 is at 00:23:12:13:5a:55"
"462","10.542446","Technico_57:12:15","Broadcast","ARP","60","Who has 10.0.0.5? Tell 10.0.0.1"
"463","10.543559","Technico_57:12:15","Broadcast","ARP","60","Who has 10.0.0.6? Tell 10.0.0.1"
"464","10.843676","fe80::c627:95ff:fe57:1215","fe80::9c:6c7:586:a22","ICMPv6","86","Neighbor Solicitation for fe80::9c:6c7:586:a22 from c4:27:95:57:12:15"
"465","10.843749","fe80::9c:6c7:586:a22","fe80::c627:95ff:fe57:1215","ICMPv6","78","Neighbor Advertisement fe80::9c:6c7:586:a22 (sol)"
"466","10.920318","10.0.0.7","52.41.196.250","TCP","66","[TCP Retransmission] 61635  >  443 [FIN, ACK] Seq=1 Ack=1 Win=4096 Len=0 TSval=113533228 TSecr=6792228"
"467","10.967792","10.0.0.7","23.64.65.225","TLSv1.2","431","Application Data"
"468","10.984567","23.64.65.225","10.0.0.7","TLSv1.2","377","Application Data"
"469","10.984692","10.0.0.7","23.64.65.225","TCP","66","61709  >  443 [ACK] Seq=1815 Ack=1553 Win=4086 Len=0 TSval=113533291 TSecr=836980048"
"470","11.855299","10.0.0.7","52.36.144.43","TLSv1.2","144","Application Data"
"471","11.954750","52.36.144.43","10.0.0.7","TCP","66","443  >  61693 [ACK] Seq=1 Ack=79 Win=88 Len=0 TSval=4113383117 TSecr=113534161"
"472","12.105398","2601:14c:4302:90c0:5915:693a:b5c4:d777","2604:a880:400:d0::2221:3001","TCP","86","[TCP Retransmission] 61702  >  443 [FIN, ACK] Seq=1 Ack=1 Win=32768 Len=0 TSval=113534409 TSecr=38782571"
"473","12.124954","2604:a880:400:d0::2221:3001","2601:14c:4302:90c0:5915:693a:b5c4:d777","ICMPv6","134","Destination Unreachable (Port unreachable)"
"474","12.491088","10.0.0.7","54.235.65.212","TCP","66","[TCP Retransmission] 61701  >  443 [FIN, ACK] Seq=1 Ack=1 Win=4096 Len=0 TSval=113534793 TSecr=918070515"
"475","12.491089","10.0.0.7","104.16.109.18","TCP","54","[TCP Retransmission] 61640  >  443 [FIN, ACK] Seq=2 Ack=1 Win=32768 Len=0"
"476","12.586163","10.0.0.7","104.16.3.9","TCP","54","[TCP Retransmission] 61649  >  443 [FIN, ACK] Seq=1 Ack=1 Win=8192 Len=0"
"477","12.617278","10.0.0.7","104.16.3.9","TCP","54","[TCP Retransmission] 61648  >  443 [FIN, ACK] Seq=1 Ack=1 Win=8192 Len=0"
"478","12.617279","10.0.0.7","23.34.1.71","TCP","66","[TCP Retransmission] 61645  >  443 [FIN, ACK] Seq=1 Ack=1 Win=4096 Len=0 TSval=113534919 TSecr=836787780"
"479","12.732836","10.0.0.7","198.232.125.123","TCP","54","[TCP Retransmission] 61699  >  443 [FIN, ACK] Seq=1 Ack=1 Win=8192 Len=0"
"480","12.732836","10.0.0.7","198.232.125.123","TCP","54","[TCP Retransmission] 61697  >  443 [FIN, ACK] Seq=1 Ack=1 Win=8192 Len=0"
"481","13.480894","10.0.0.7","35.162.141.229","TCP","66","[TCP Retransmission] 61694  >  80 [FIN, ACK] Seq=1 Ack=1 Win=4096 Len=0 TSval=113535781 TSecr=6773471"
"482","13.496930","10.0.0.7","52.41.196.250","TCP","66","[TCP Retransmission] 61635  >  443 [FIN, ACK] Seq=1 Ack=1 Win=4096 Len=0 TSval=113535797 TSecr=6792228"
"483","14.230019","2601:14c:4302:90c0:5915:693a:b5c4:d777","2604:a880:400:d0::2221:3001","TCP","86","[TCP Retransmission] 61702  >  443 [FIN, ACK] Seq=1 Ack=1 Win=32768 Len=0 TSval=113536529 TSecr=38782571"
"484","14.253591","2604:a880:400:d0::2221:3001","2601:14c:4302:90c0:5915:693a:b5c4:d777","ICMPv6","134","Destination Unreachable (Port unreachable)"
"485","14.590045","10.0.0.7","104.17.31.15","TCP","54","[TCP Retransmission] 61643  >  443 [FIN, ACK] Seq=1 Ack=1 Win=8192 Len=0"
"486","14.614150","10.0.0.7","54.235.65.212","TCP","66","[TCP Retransmission] 61701  >  443 [FIN, ACK] Seq=1 Ack=1 Win=4096 Len=0 TSval=113536913 TSecr=918070515"
"487","14.614150","10.0.0.7","104.16.109.18","TCP","54","[TCP Retransmission] 61640  >  443 [FIN, ACK] Seq=2 Ack=1 Win=32768 Len=0"
"488","14.709933","10.0.0.7","104.16.3.9","TCP","54","[TCP Retransmission] 61649  >  443 [FIN, ACK] Seq=1 Ack=1 Win=8192 Len=0"
"489","14.742009","10.0.0.7","104.16.3.9","TCP","54","[TCP Retransmission] 61648  >  443 [FIN, ACK] Seq=1 Ack=1 Win=8192 Len=0"
"490","14.742070","10.0.0.7","23.34.1.71","TCP","66","[TCP Retransmission] 61645  >  443 [FIN, ACK] Seq=1 Ack=1 Win=4096 Len=0 TSval=113537040 TSecr=836787780"
"491","15.173902","10.0.0.7","23.64.65.225","TLSv1.2","432","Application Data"
"492","15.213820","23.64.65.225","10.0.0.7","TLSv1.2","376","Application Data"
"493","15.213915","10.0.0.7","23.64.65.225","TCP","66","61709  >  443 [ACK] Seq=2181 Ack=1863 Win=4086 Len=0 TSval=113537509 TSecr=836984277"
"494","15.554799","Technico_57:12:15","Broadcast","ARP","60","Who has 10.0.0.11? Tell 10.0.0.1"
"495","15.555943","Technico_57:12:15","Broadcast","ARP","60","Who has 10.0.0.15? Tell 10.0.0.1"
"496","15.557102","Technico_57:12:15","Broadcast","ARP","60","Who has 10.0.0.3? Tell 10.0.0.1"
"497","15.558203","Technico_57:12:15","Broadcast","ARP","60","Who has 10.0.0.6? Tell 10.0.0.1"
"498","15.559298","Technico_57:12:15","Broadcast","ARP","60","Who has 10.0.0.14? Tell 10.0.0.1"
"499","15.560463","Technico_57:12:15","Broadcast","ARP","60","Who has 10.0.0.16? Tell 10.0.0.1"
"500","16.071988","10.0.0.7","52.41.196.250","TCP","66","[TCP Retransmission] 61635  >  443 [FIN, ACK] Seq=1 Ack=1 Win=4096 Len=0 TSval=113538365 TSecr=6792228"
"501","16.357038","2601:14c:4302:90c0:5915:693a:b5c4:d777","2604:a880:400:d0::2221:3001","TCP","86","[TCP Retransmission] 61702  >  443 [FIN, ACK] Seq=1 Ack=1 Win=32768 Len=0 TSval=113538650 TSecr=38782571"
"502","16.380076","2604:a880:400:d0::2221:3001","2601:14c:4302:90c0:5915:693a:b5c4:d777","ICMPv6","134","Destination Unreachable (Port unreachable)"
